models_results/herbert/metrics.csv

,eval_loss,eval_accuracy,eval_f1_macro,eval_f1_weighted,eval_runtime,eval_samples_per_second,eval_steps_per_second,epoch
validation,0.06676746904850006,0.9739779364049319,0.9745163734897054,0.9768572229170969,42.383,363.589,10.122,4.0
test,0.06526609510183334,0.9729414054895854,0.9744327940806998,0.9757799087015374,39.4647,390.501,10.87,4.0

README.md

### Abstract  

The project developed a web application for early patient health risk assessment, integrating 
profile data, test results, and surveys to support primary care physicians in the diagnostic 
process and clinical decision-making. Machine learning and natural language processing (NLP) 
models were used for data analysis: XGBoost, HerBERT, Mistral, and its variant enriched with 
an additional knowledge base (RAG), as well as MarianMT for translation. The HerBERT and 
XGBoost models were trained on datasets of 154,896 and 147,853 cases, respectively, spanning 
26 classes representing medical specialties. The XGBoost model achieved 87.4% accuracy, 
HerBERT 97.3%, and Mistral and Mistral, with an external knowledge base, achieved 71% and 
78% correct classifications, respectively. Implementation required Python with the pandas, 
NumPy, scikit-learn, PyTorch, and Transformers libraries, and the Django framework for 
interface development. The developed system combines medical case classification, model 
retraining and patient data analysis.

### Evaluation of the HerBERT Model After Training

The HerBERT model was retrained to perform classification of medical cases into appropriate medical specialties. Evaluation on the validation and test datasets showed very high performance, with accuracy reaching 97.38% on the validation set and 97.29% on the test set.

The results were also confirmed by the F1 metrics. F1-macro reached 0.9745 for the validation set and 0.9744 for the test set, while F1-weighted achieved 0.9769 and 0.9758, respectively. The small differences between validation and test results indicate good generalization and no significant signs of overfitting.

## Conclusions and Comments

After retraining, HerBERT achieved an accuracy of 97.3%, with F1-macro of 0.974 and F1-weighted of 0.976. The model showed strong generalization capabilities, with only minor errors between specialties with overlapping clinical symptoms, such as neurology and psychiatry.